{
  "schema": "arena.game-record/1",
  "game_index": 417,
  "seed": 4200417,
  "seats": ["net-atraxa", "selvala-b3", "net-muldrotha", "net-krenko"],
  "result": "win",
  "winner_seat": 1,
  "win_condition": "combo",
  "combo_id": "csb-4131",
  "route": "SPREAD_COMBAT",
  "turns": 9,
  "duration_ms": 94213,
  "seat_stats": [
    {"deck": "net-atraxa", "mulligans": 1, "opening_hand_size": 7, "turns_played": 9},
    {"deck": "selvala-b3", "mulligans": 0, "opening_hand_size": 7, "turns_played": 9, "commander_cast_turn": 3},
    {"deck": "net-muldrotha", "mulligans": 0, "opening_hand_size": 7, "turns_played": 8, "eliminated_turn": 9},
    {"deck": "net-krenko", "mulligans": 2, "opening_hand_size": 7, "turns_played": 8, "eliminated_turn": 9}
  ],
  "event_log": "events/000417.jsonl"
}
